{
  "name": "samsara_zendesk.first_resolution_time",
  "owner": "DataEngineering",
  "nonproduction": true,
  "description": "Get the first resolution times in calendar minutes for zendesk tickets",
  "dependencies": [
    {
      "external": true,
      "dbname": "samsara_zendesk",
      "tablename": "ticket_field_history",
      "type": "table"
    },
    {
      "external": true,
      "dbname": "samsara_zendesk",
      "tablename": "ticket",
      "type": "table"
    }
  ],
  "backfill_start_date": "2015-07-28",
  "parameters": ["start_date", "end_date"],
  "output": {
    "dbname": "samsara_zendesk",
    "tablename": "first_resolution_time",
    "type": "table",
    "primary_key": ["ticket_id"],
    "schema": [
      {
        "name": "ticket_id",
        "type": "long"
      },
      {
        "name": "last_updated_at",
        "type": "date"
      },
      {
        "name": "first_resolution_time_in_calendar_minutes",
        "type": "double",
        "nullable": false
      }
    ],
    "write_mode": "merge"
  },
  "disabled_regions": ["eu-west-1", "ca-central-1"]
}
