{
  "name": "safety_report.trip_with_safety_event_labels_hourly_agg_v2",
  "owner": "SafetyScoringInsights",
  "nonproduction": false,
  "description": "Number of trips with the same earliest safety event labels per trip aggregated for each object hourly",
  "dependencies": [
    {
      "external": false,
      "dbname": "safety_report",
      "tablename": "trip_with_safety_event_labels_v2",
      "type": "table"
    }
  ],
  "backfill_start_date": "2018-01-01",
  "parameters": ["start_date", "end_date"],
  "unsharded_backfills": true,
  "output": {
    "dbname": "safety_report",
    "tablename": "trip_with_safety_event_labels_hourly_agg_v2",
    "type": "table",
    "partition": ["date"],
    "write_mode": "overwrite",
    "primary_key": [
      "org_id",
      "object_id",
      "object_type",
      "interval_start",
      "trip_version",
      "release_stage",
      "label_source",
      "in_dismissed_states",
      "in_recognition_states",
      "in_coaching_states",
      "in_triage_states"
    ],
    "schema": [
      {
        "name": "org_id",
        "type": "long",
        "metadata": {
          "comment": "$org_id_default_description"
        }
      },
      {
        "name": "object_id",
        "nullable": true,
        "type": "long",
        "metadata": {
          "comment": "an id that can represent a driver_id or device_id"
        }
      },
      {
        "name": "object_type",
        "type": "integer",
        "nullable": false,
        "metadata": {
          "comment": "determine the object representation of object_id, 1 for device and 5 for driver"
        }
      },
      {
        "name": "interval_start",
        "type": "timestamp",
        "metadata": {
          "comment": "Start time of the hourly aggregation"
        }
      },
      {
        "name": "date",
        "type": "date"
      },
      {
        "name": "trip_version",
        "type": "integer"
      },
      {
        "name": "release_stage",
        "type": "short"
      },
      {
        "name": "in_dismissed_states",
        "type": "byte"
      },
      {
        "name": "in_recognition_states",
        "type": "byte"
      },
      {
        "name": "in_coaching_states",
        "type": "byte"
      },
      {
        "name": "in_triage_states",
        "type": "byte"
      },

      {
        "name": "label_source",
        "type": "integer"
      },
      {
        "name": "invalid_count",
        "type": "long"
      },
      {
        "name": "generic_tailgating_count",
        "type": "long"
      },
      {
        "name": "generic_distraction_count",
        "type": "long"
      },
      {
        "name": "defensive_driving_count",
        "type": "long"
      },
      {
        "name": "rolling_stop_count",
        "type": "long"
      },
      {
        "name": "near_collison_count",
        "type": "long"
      },
      {
        "name": "speeding_count",
        "type": "long"
      },
      {
        "name": "obstructed_camera_count",
        "type": "long"
      },
      {
        "name": "did_not_yield_count",
        "type": "long"
      },
      {
        "name": "no_seatbelt_count",
        "type": "long"
      },
      {
        "name": "mobile_usage_count",
        "type": "long"
      },
      {
        "name": "drowsy_count",
        "type": "long"
      },
      {
        "name": "lane_departure_count",
        "type": "long"
      },
      {
        "name": "following_distance_severe_count",
        "type": "long"
      },
      {
        "name": "following_distance_moderate_count",
        "type": "long"
      },
      {
        "name": "late_response_count",
        "type": "long"
      },
      {
        "name": "acceleration_count",
        "type": "long"
      },
      {
        "name": "braking_count",
        "type": "long"
      },
      {
        "name": "harsh_turn_count",
        "type": "long"
      },
      {
        "name": "crash_count",
        "type": "long"
      },
      {
        "name": "rollover_protection_count",
        "type": "long"
      },
      {
        "name": "yaw_control_count",
        "type": "long"
      },
      {
        "name": "ran_red_light_count",
        "type": "long"
      },
      {
        "name": "forward_collision_warning_count",
        "type": "long"
      },
      {
        "name": "eating_drinking_count",
        "type": "long"
      },
      {
        "name": "smoking_count",
        "type": "long"
      },
      {
        "name": "following_distance_count",
        "type": "long"
      },
      {
        "name": "edge_distracted_driving_count",
        "type": "long"
      },
      {
        "name": "policy_violation_mask_count",
        "type": "long"
      },
      {
        "name": "eating_count",
        "type": "long"
      },
      {
        "name": "drinking_count",
        "type": "long"
      },
      {
        "name": "edge_railroad_crossing_violation_count",
        "type": "long"
      },
      {
        "name": "max_speed_count",
        "type": "long"
      },
      {
        "name": "severe_speeding_count",
        "type": "long"
      }
    ]
  },
  "expectation": {
    "batch_mode": "FAIL_ALL"
  }
}
