{
  "name": "fuel_energy_efficiency_report.engine_state_fuel_by_hour_v3",
  "owner": "Sustainability",
  "description": "Interval hours for driver-device combinations containing engine state durations and fuel consumed after filtering out fuel consumption that occurs during spotty ECU segments.",
  "tags": ["telematics", "fuel", "ev"],
  "dependencies": [
    {
      "dbname": "engine_state_report",
      "tablename": "engine_state_pto_fuel_intervals",
      "type": "table"
    },
    {
      "dbname": "fuel_energy_efficiency_report",
      "tablename": "ecu_filter_segments",
      "type": "table"
    },
    {
      "dbname": "fuel_energy_efficiency_report",
      "tablename": "driver_assignments",
      "type": "table"
    }
  ],
  "parameters": ["start_date", "end_date"],
  "backfill_start_date": "2024-11-13",
  "output": {
    "dbname": "fuel_energy_efficiency_report",
    "tablename": "engine_state_fuel_by_hour_v3",
    "type": "table",
    "partition": ["date"],
    "write_mode": "overwrite",
    "primary_key": ["date", "org_id", "object_id", "driver_id", "interval_start"],
    "schema": [
      {
        "name": "date",
        "type": "date",
        "metadata": {
          "comment": "The date of this hour interval."
        },
        "nullable": false
      },
      {
        "name": "org_id",
        "type": "long",
        "metadata": {
          "comment": "$org_id_default_description"
        }
      },
      {
        "name": "object_id",
        "type": "long",
        "metadata": {
          "comment": "The device id of this hour of data."
        }
      },
      {
        "name": "driver_id",
        "type": "long",
        "metadata": {
          "comment": "The driver who was assigned to this vehicle during this hour of data."
        },
        "nullable": false
      },
      {
        "name": "interval_start",
        "type": "timestamp",
        "metadata": {
          "comment": "The starting timestamp of this hourly interval."
        }
      },
      {
        "name": "interval_end",
        "type": "timestamp",
        "metadata": {
          "comment": "The ending timestamp of this hourly interval."
        }
      },
      {
        "name": "on_duration_ms",
        "type": "long",
        "metadata": {
          "comment": "The duration in milliseconds that this vehicle's engine was ON during this hour."
        }
      },
      {
        "name": "idle_duration_ms",
        "type": "long",
        "metadata": {
          "comment": "The duration in milliseconds that this vehicle's engine was IDLE during this hour."
        }
      },
      {
        "name": "aux_during_idle_ms",
        "type": "long",
        "metadata": {
          "comment": "The duration in milliseconds that productive auxiliary power was being used during engine IDLE time. Productive auxiliary power can be used for PTO (power take-off), a plow, a sweeper, a salter, a door, a boom, or an engine."
        }
      },
      {
        "name": "fuel_consumed_ml",
        "type": "long",
        "metadata": {
          "comment": "The amount of fuel consumed in milliliters during this hour."
        }
      },
      {
        "name": "gaseous_fuel_consumed_grams",
        "type": "long",
        "metadata": {
          "comment": "The amount of gaseous fuel consumed in grams during this hour."
        }
      }
    ]
  }
}
