{
  "name": "material_usage_report.aggr_material_usage_by_hour_v2",
  "owner": "DiagnosticsTools",
  "description": "Material usage stats by hour broken down by material type (dry, wet, prewet) and different methodologies available for computing each material type's usage",
  "dependencies": [
    {
      "external": false,
      "dbname": "material_usage_report",
      "tablename": "aggr_dry_material_spread_by_hour_v2",
      "type": "table"
    },
    {
      "external": false,
      "dbname": "material_usage_report",
      "tablename": "aggr_wet_material_spread_by_hour_v2",
      "type": "table"
    },
    {
      "external": false,
      "dbname": "material_usage_report",
      "tablename": "aggr_prewet_material_spread_by_hour_v2",
      "type": "table"
    },
    {
      "external": false,
      "dbname": "material_usage_report",
      "tablename": "time_driven_by_hour",
      "type": "table"
    }
  ],
  "parameters": ["start_date", "end_date"],
  "output": {
    "dbname": "material_usage_report",
    "tablename": "aggr_material_usage_by_hour_v2",
    "type": "table",
    "partition": ["date"],
    "primary_key": ["date", "org_id", "device_id", "interval_start"],
    "schema": [
      {
        "name": "date",
        "type": "date"
      },
      {
        "name": "org_id",
        "type": "long"
      },
      {
        "name": "device_id",
        "type": "long"
      },
      {
        "name": "interval_start",
        "type": "timestamp"
      },
      {
        "name": "dry_quantity_spread_mg_from_deltas",
        "type": "long"
      },
      {
        "name": "dry_quantity_spread_mg_from_spread_rate",
        "type": "double"
      },
      {
        "name": "dry_distance_spread_meters_from_spread_rate",
        "type": "double"
      },
      {
        "name": "dry_duration_spread_ms_from_spread_rate",
        "type": "long"
      },
      {
        "name": "wet_quantity_spread_ml_from_deltas",
        "type": "long"
      },
      {
        "name": "wet_quantity_spread_ml_from_spread_rate",
        "type": "double"
      },
      {
        "name": "wet_distance_spread_meters_from_spread_rate",
        "type": "double"
      },
      {
        "name": "wet_duration_spread_ms_from_spread_rate",
        "type": "long"
      },
      {
        "name": "prewet_quantity_spread_ml_from_deltas",
        "type": "long"
      },
      {
        "name": "prewet_quantity_spread_ml_from_spread_rate",
        "type": "double"
      },
      {
        "name": "prewet_distance_spread_meters_from_spread_rate",
        "type": "double"
      },
      {
        "name": "prewet_duration_spread_ms_from_spread_rate",
        "type": "long"
      },
      {
        "name": "prewet_quantity_spread_ml_from_mix_rate",
        "type": "double"
      },
      {
        "name": "prewet_distance_spread_meters_from_mix_rate",
        "type": "double"
      },
      {
        "name": "prewet_duration_spread_ms_from_mix_rate",
        "type": "long"
      },
      {
        "name": "duration_driven_ms",
        "type": "long"
      }
    ],
    "write_mode": "overwrite"
  },
  "expectation": {
    "batch_mode": "KEEP_ALL"
  },
  "backfill_start_date": "2021-12-01"
}
