{
  "name": "objectstat_diffs.accel_engine_torque_over_limit",
  "owner": "Sustainability",
  "description": "Calculate accel engine torque diffs from kinesisstats.osdderivedaccelenginetorqueoverlimitms object stat",
  "dependencies": [
    {
      "external": true,
      "dbname": "kinesisstats",
      "tablename": "osdderivedaccelenginetorqueoverlimitms",
      "type": "table"
    }
  ],
  "tags": ["ecodriving"],
  "parameters": ["start_date", "end_date"],
  "output": {
    "dbname": "objectstat_diffs",
    "tablename": "accel_engine_torque_over_limit",
    "type": "table",
    "partition": ["date"],
    "write_mode": "overwrite",
    "primary_key": ["date", "org_id", "object_id", "time"],
    "schema": [
      {
        "name": "date",
        "type": "date",
        "metadata": {
          "comment": "The date when the high engine torque was recorded."
        }
      },
      {
        "name": "org_id",
        "type": "long",
        "metadata": {
          "comment": "$org_id_default_description"
        }
      },
      {
        "name": "object_id",
        "type": "long",
        "metadata": {
          "comment": "The ID of the Samsara device from which the high engine torque was recorded."
        }
      },
      {
        "name": "time",
        "type": "long",
        "metadata": {
          "comment": "The time in milliseconds at which the high engine torque was recorded."
        }
      },
      {
        "name": "accel_engine_torque_over_limit_ms",
        "type": "long",
        "metadata": {
          "comment": "The high engine torque duration in milliseconds."
        }
      }
    ]
  }
}
