{
  "name": "risk_overview.driver_filtered",
  "owner": "SafetyRisk",
  "description": "Filters out deleted drivers from clouddb.drivers.",
  "backfill_start_date": "2025-05-10",
  "dependencies": [
    {
      "external": true,
      "dbname": "clouddb",
      "tablename": "drivers",
      "type": "table"
    }
  ],
  "parameters": ["start_date"],
  "output": {
    "dbname": "risk_overview",
    "tablename": "driver_filtered",
    "type": "table",
    "write_mode": "overwrite",
    "primary_key": ["id", "org_id"],
    "schema": [
      {
        "name": "id",
        "type": "long"
      },
      {
        "name": "org_id",
        "type": "long"
      }
    ]
  }
}
