{
  "name": "engine_state.corrected_stats",
  "owner": "Sustainability",
  "description": "Computes the corrected engine state stats by subtracting offsets (minimum idle time and engine activity timeouts) and modifying values based on object stat flags.",
  "dependencies": [
    {
      "external": true,
      "dbname": "kinesisstats",
      "tablename": "osdenginestate",
      "type": "table"
    },
    {
      "external": true,
      "dbname": "helpers",
      "tablename": "ignored_org_ids",
      "type": "table"
    }
  ],
  "parameters": ["start_date", "end_date"],
  "backfill_start_date": "2024-08-01",
  "output": {
    "dbname": "engine_state",
    "tablename": "corrected_stats",
    "type": "table",
    "partition": ["date"],
    "primary_key": ["date", "org_id", "object_id", "time"],
    "schema": [
      {
        "name": "date",
        "type": "date",
        "metadata": {
          "comment": "Date when the object stat was reported."
        }
      },
      {
        "name": "org_id",
        "type": "long",
        "metadata": {
          "comment": "The organization ID for which the engine state object stat is reported."
        }
      },
      {
        "name": "object_id",
        "type": "long",
        "metadata": {
          "comment": "The device ID for which the engine state object stat is reported."
        }
      },
      {
        "name": "time",
        "type": "long",
        "metadata": {
          "comment": "The time in milliseconds at which the engine state object stat is reported"
        }
      },
      {
        "name": "int_value",
        "type": "long",
        "metadata": {
          "comment": "Corresponds to the engine state. \n0: Engine State Off\n1: Engine State Idle\n2: Engine State On"
        }
      }
    ],
    "write_mode": "overwrite"
  }
}
